{
  "commit": "225ed16f831018803ce8e94f6fdc660d13352bf4",
  "findings": [
    {
      "evidence": "R15PostgresStore.audit inserts into hhy.admin_operation_logs(admin_id,operation,resource,request_id,ip,created_at), but the table is defined with action and resource_id columns and no operation/request_id columns in V002__access_admin_and_platform.sql:265-274. Any admin support mutation that calls audit after mutating/outboxing will fail with a SQL column error.",
      "issue": "Admin support mutation audit writes to nonexistent database columns, causing runtime failure and possible partial side effects.",
      "line": 293,
      "path": "services/backend/access/src/main/java/cc/orbexa/hhy/access/r15/R15PostgresStore.java",
      "requirement_ref": "TASK-R15-RECOVERY-006: 权限/幂等/错误码/审计覆盖; 跨模块副作用写Outbox",
      "severity": "HIGH"
    },
    {
      "evidence": "The chat report endpoints return SupportTicketPage/SupportTicketResource and delegate to support ticket service methods. OpenAPI requires AdminChatGetChatReportsResponse items to be ConversationResource and AdminChatPostChatReportsByIdDecideRequest to contain decision/reason/expectedVersion/evidenceIds (admin-openapi.yaml:25145-25252). The controller instead lists/closes support tickets under /chat-reports.",
      "issue": "adminChatGetChatReports and adminChatPostChatReportsByIdDecide implement the wrong domain and response/request contract.",
      "line": 51,
      "path": "services/backend/boot/src/main/java/cc/orbexa/hhy/boot/admin/R15SupportAdminController.java",
      "requirement_ref": "TASK-R15-RECOVERY-006: 实现范围内25个operationId; OpenAPI契约测试",
      "severity": "HIGH"
    },
    {
      "evidence": "helpArticles builds SQL as SELECT ... FROM hhy.cms_articles WHERE ... ORDER BY item.updated_at..., but the FROM clause has no item alias. The generated query for /api/v1/help/articles will fail at runtime with a missing FROM-clause entry for item.",
      "issue": "supportGetHelpArticles SQL uses an undefined alias, so the R15 help article list endpoint is broken.",
      "line": 187,
      "path": "services/backend/access/src/main/java/cc/orbexa/hhy/access/r15/R15PostgresStore.java",
      "requirement_ref": "TASK-R15-RECOVERY-006: 实现范围内25个operationId; OpenAPI契约测试",
      "severity": "HIGH"
    },
    {
      "evidence": "notificationPostNotificationsByIdRead is x-idempotent in contracts/openapi.yaml:5980-5988, and the service passes key/requestHash to markNotificationRead. The store ignores both values and only updates read_at/updated_at. A replay with the same X-Idempotency-Key and original expectedVersion will conflict after updated_at changes instead of replaying the prior success.",
      "issue": "Notification read idempotency is not implemented despite the frozen contract requiring it.",
      "line": 150,
      "path": "services/backend/access/src/main/java/cc/orbexa/hhy/access/r15/R15PostgresStore.java",
      "requirement_ref": "TASK-R15-RECOVERY-006: 权限/幂等/错误码/审计覆盖",
      "severity": "HIGH"
    },
    {
      "evidence": "New controllers require report.decide, appeal.decide, chat.report.decide, support.read, support.assign, support.reply, and support.close. Existing migrations only create chat.report.read/chat.report.manage/support.manage in V008:32-34 and V041 creates review.decide/report.read/appeal.read but not report.decide/appeal.decide. AdminSecurityStore loads exact p.code values into SimpleGrantedAuthority, so these endpoints have no seeded matching authorities.",
      "issue": "R15 admin endpoints require permission codes that are not provisioned by migrations, making the protected operations inaccessible under normal RBAC data.",
      "line": 75,
      "path": "services/backend/boot/src/main/java/cc/orbexa/hhy/boot/admin/R15SupportAdminController.java",
      "requirement_ref": "TASK-R15-RECOVERY-006: 权限/幂等/错误码/审计覆盖",
      "severity": "HIGH"
    }
  ],
  "schema": "hhy.reviewer-result/v5.0",
  "status": "BLOCK",
  "summary": "候选不满足 TASK-R15-RECOVERY-006。审查未发现该 diff 删除或跳过既有测试，但新增静态 guard 只做文本匹配，未覆盖上述契约、数据库、权限和幂等问题。",
  "task_id": "TASK-R15-RECOVERY-006"
}
