{
  "commit": "a79397eb46aa8d2b387157250588b489470b6a4d",
  "findings": [
    {
      "evidence": "User endpoint passes principal.userId() into addUserTicketMessage, but that method immediately delegates to addTicketMessage; addTicketMessage inserts by ticket_id only and returns adminTicket(id), so a normal user can append to and receive details for any ticket id if they know it. There is no WHERE user_id=? ownership check in the write path.",
      "issue": "User support-ticket message write bypasses ticket ownership and leaks cross-user ticket details.",
      "line": 215,
      "path": "services/backend/content/src/main/java/cc/orbexa/hhy/content/R15NotificationSupportService.java",
      "requirement_ref": "ACTIVE_TASK acceptance: 权限/幂等/错误码/审计覆盖; risks: security",
      "severity": "BLOCKER"
    },
    {
      "evidence": "DecideRequest/AssignRequest/CloseRequest require expectedVersion, but content-report decide updates with WHERE id=? only, support assign updates with WHERE id=? only, and support close updates with WHERE id=? AND status='RESOLVED' only. These writes neither compare expectedVersion nor increment a version, allowing stale admin decisions/assignments/closes to overwrite current state.",
      "issue": "Required optimistic-concurrency contract is ignored on admin write operations.",
      "line": 416,
      "path": "services/backend/content/src/main/java/cc/orbexa/hhy/content/R15NotificationSupportService.java",
      "requirement_ref": "ACTIVE_TASK acceptance: 权限/幂等/错误码/审计覆盖",
      "severity": "HIGH"
    },
    {
      "evidence": "ACTIVE_TASK requires implementing 25 operationIds and OpenAPI contract tests, but the added R15_OPERATION_IDS set contains only 23 strings and the test checks Java source text rather than OpenAPI contract behavior. This can pass while the declared 25-operation contract remains incomplete or mismatched.",
      "issue": "Added test weakens the contract gate by hardcoding an incomplete 23-operation source-text check instead of validating the required 25 OpenAPI operations.",
      "line": 16,
      "path": "tests/test_r15_notification_support_backend_surface.py",
      "requirement_ref": "ACTIVE_TASK objective/deliverables: 实现范围内25个operationId; OpenAPI契约测试",
      "severity": "HIGH"
    }
  ],
  "schema": "hhy.reviewer-result/v5.0",
  "status": "BLOCK",
  "summary": "候选不满足当前任务。未发现通过删除或跳过既有测试取得通过的证据，diff 为 5 个新增文件、0 删除；但新增实现存在可复核的权限与契约正确性问题，且新增测试以不完整硬编码文本检查替代 25-operation OpenAPI 契约验证。",
  "task_id": "TASK-R15-RECOVERY-004"
}
