{
  "commit": "860e7806bef507f311393c0432cea71806ed2d3a",
  "findings": [
    {
      "evidence": "AdminDecisionRequest/AdminSupport* DTOs require expectedVersion, but R15Service accepts only expectedVersion == 0 via expectZero() and does not pass that version to content report, appeal, assign, or close store calls. The store then updates hhy.content_reports, hhy.content_appeals, and hhy.support_tickets by id only, without a version predicate or version increment, while projecting version 0 back. Stale or concurrent admin writes will overwrite instead of returning the required 409 conflict.",
      "issue": "expectedVersion is effectively bypassed for multiple admin write operations, breaking concurrency/error-code correctness.",
      "line": 270,
      "path": "services/backend/content/src/main/java/cc/orbexa/hhy/content/R15Service.java",
      "requirement_ref": "ACTIVE_TASK.acceptance: 权限/幂等/错误码/审计覆盖",
      "severity": "HIGH"
    },
    {
      "evidence": "SupportTicketRequest and SupportTicketMessageRequest include attachments, and R15PostgresStore persists those attachments into hhy.ticket_attachments, but the idempotency hashes for support.create and support.user_message include only category/subject/content or content. withIdempotency compares only that hash and replays the prior response, so reusing the same idempotency key with different attachments is not detected as a different request.",
      "issue": "idempotency request hashes omit persisted request fields, allowing different payloads to be treated as identical replays.",
      "line": 112,
      "path": "services/backend/content/src/main/java/cc/orbexa/hhy/content/R15Service.java",
      "requirement_ref": "ACTIVE_TASK.acceptance: 权限/幂等/错误码/审计覆盖",
      "severity": "HIGH"
    },
    {
      "evidence": "test_r15_operation_ids_have_unique_controller_methods reads OpenAPI method/path pairs, but the assertions only regex-match a Java method name once. It never checks @GetMapping/@PostMapping HTTP method, route path, parameters, request/response schema, or error responses, so the acceptance 'OpenAPI contract test' can pass with contract-incompatible controller mappings.",
      "issue": "the added OpenAPI contract test is weakened to operationId-name presence only and does not validate the actual OpenAPI contract.",
      "line": 36,
      "path": "tests/test_r15_backend_contract.py",
      "requirement_ref": "ACTIVE_TASK.deliverables: OpenAPI契约测试",
      "severity": "HIGH"
    }
  ],
  "schema": "hhy.reviewer-result/v5.0",
  "status": "BLOCK",
  "summary": "Reviewed only governance/runtime/ACTIVE_TASK.json and diff 73652dfed1fc52cf7d871f7819484f477af0e5b8..860e7806bef507f311393c0432cea71806ed2d3a. Changes are within allowed paths and I saw no test deletions, but the candidate has HIGH correctness/contract issues and should block.",
  "task_id": "TASK-R15-003"
}
