{
  "commit": "f4154c231d84e4f5ec40fb6f3adc21a934e399a7",
  "findings": [
    {
      "evidence": "f4154c adds POST /api/v1/support/tickets in R15NotificationSupportController, while the existing UserSelfServiceController already has the same @PostMapping at lines 42-48 with no disambiguating params/consumes condition. Spring MVC will treat this as an ambiguous mapping during handler registration.",
      "issue": "新增 R15 工单创建接口与既有用户工单创建接口完全同路由，候选会产生启动级 ambiguous mapping，无法作为可运行候选。",
      "line": 140,
      "path": "services/backend/boot/src/main/java/cc/orbexa/hhy/boot/user/R15NotificationSupportController.java",
      "requirement_ref": "TASK-R15-RECOVERY-004 deliverables: OpenAPI契约测试 / 通过 task Gate",
      "severity": "BLOCKER"
    },
    {
      "evidence": "The diff replaces `assert sql == runtime` with substring checks at this line. Only services/backend/boot/src/main/resources/db/migration/V048__r15_notification_support_invariants.sql changed in the candidate; database/migrations/V048__r15_notification_support_invariants.sql did not. Their SHA-256 values differ: database=6A4E506A00225EF8D5DC258C3365EC5D217A86617E6E781933FFAD794B6E5647, runtime=271BAF13D63D67458C1FB222408C3B1ADDC09A38580B8296BDF484A3EA6864F7. The PostgreSQL upgrade test still executes SOURCE, so the modified runtime migration is no longer proved equivalent or executed by that matrix.",
      "issue": "数据库迁移同步测试被弱化，掩盖 runtime migration 与 canonical database migration 的真实漂移，属于通过弱化测试取得通过。",
      "line": 213,
      "path": "tests/test_r15_notification_support_postgres.py",
      "requirement_ref": "TASK-R15-RECOVERY-004 acceptance: 代码、文档、测试、追踪同步更新；不得删除、跳过或弱化测试",
      "severity": "HIGH"
    },
    {
      "evidence": "ACTIVE_TASK requires implementing 25 operationIds. The added contract test enumerates 13 user operations at lines 17-30 and 11 admin operations at lines 37-48, and the candidate controllers contain 13 user + 11 admin @GetMapping/@PostMapping annotations, total 24.",
      "issue": "候选没有满足当前任务的 25 个 operationId 目标；新增契约测试只冻结 24 个操作，缺少的 operationId 未被实现或测试覆盖。",
      "line": 8,
      "path": "governance/runtime/ACTIVE_TASK.json",
      "requirement_ref": "TASK-R15-RECOVERY-004 objective",
      "severity": "HIGH"
    }
  ],
  "schema": "hhy.reviewer-result/v5.0",
  "status": "BLOCK",
  "summary": "候选不满足 TASK-R15-RECOVERY-004：存在启动级重复路由、数据库迁移同步测试弱化且真实漂移、operationId 数量少于任务要求。",
  "task_id": "TASK-R15-RECOVERY-004"
}
